{
  "hsc_version": "v0",
  "trace_id": "full-lifecycle-0001",
  "harness_id": "hermes",
  "harness_version": "0.16.0",
  "turns": [
    {
      "turn_id": "turn-1",
      "events": [
        {
          "span_id": "span-1",
          "trace_id": "full-lifecycle-0001",
          "parent_span_id": null,
          "name": "load context",
          "harness.event_type": "context.load",
          "harness.principle": "context",
          "harness.quadrant.x": "feedforward",
          "harness.quadrant.y": "computational"
        },
        {
          "span_id": "span-2",
          "trace_id": "full-lifecycle-0001",
          "parent_span_id": "span-1",
          "name": "emit plan",
          "harness.event_type": "plan.emit",
          "harness.principle": "plan_execute",
          "harness.quadrant.x": "feedforward",
          "harness.quadrant.y": "inferential"
        },
        {
          "span_id": "span-3",
          "trace_id": "full-lifecycle-0001",
          "parent_span_id": "span-2",
          "name": "slice task",
          "harness.event_type": "task.slice",
          "harness.principle": "one_at_a_time",
          "harness.quadrant.x": "feedforward",
          "harness.quadrant.y": "computational"
        },
        {
          "span_id": "span-4",
          "trace_id": "full-lifecycle-0001",
          "parent_span_id": "span-3",
          "name": "execute_tool write_file",
          "harness.event_type": "tool.call",
          "harness.principle": "plan_execute",
          "harness.quadrant.x": null,
          "harness.quadrant.y": null,
          "harness.mutated_state": true,
          "gen_ai.operation.name": "execute_tool",
          "gen_ai.tool.name": "write_file"
        },
        {
          "span_id": "span-5",
          "trace_id": "full-lifecycle-0001",
          "parent_span_id": "span-4",
          "name": "feedback check (programmatic)",
          "harness.event_type": "feedback.check",
          "harness.principle": "feedback",
          "harness.quadrant.x": "feedback",
          "harness.quadrant.y": "computational"
        },
        {
          "span_id": "span-6",
          "trace_id": "full-lifecycle-0001",
          "parent_span_id": "span-5",
          "name": "verify result",
          "harness.event_type": "verify.result",
          "harness.principle": "feedback",
          "harness.quadrant.x": "feedback",
          "harness.quadrant.y": "computational"
        },
        {
          "span_id": "span-7",
          "trace_id": "full-lifecycle-0001",
          "parent_span_id": "span-6",
          "name": "encode doc",
          "harness.event_type": "doc.encode",
          "harness.principle": "codebase_docs",
          "harness.quadrant.x": "feedforward",
          "harness.quadrant.y": "computational"
        }
      ]
    }
  ]
}
