{
  "hsc_version": "v0",
  "trace_id": "hermes-capture-0001",
  "harness_id": "hermes",
  "harness_version": "0.16.0",
  "turns": [
    {
      "turn_id": "turn-1",
      "span_id": "a1b2c3d4e5f60718",
      "name": "invoke_agent hermes",
      "events": [
        {
          "span_id": "00000000000000a1",
          "trace_id": "0af7651916cd43dd8448eb211c80319c",
          "parent_span_id": null,
          "name": "chat context.load (inferred)",
          "harness.event_type": "context.load",
          "harness.principle": "context",
          "harness.quadrant.x": "feedforward",
          "harness.quadrant.y": "computational",
          "harness.version": "0.16.0",
          "harness.inferred": true,
          "gen_ai.operation.name": "chat",
          "gen_ai.request.model": "claude-sonnet-4",
          "gen_ai.usage.input_tokens": 4096
        },
        {
          "span_id": "00000000000000a2",
          "trace_id": "0af7651916cd43dd8448eb211c80319c",
          "parent_span_id": null,
          "name": "chat plan.emit (inferred)",
          "harness.event_type": "plan.emit",
          "harness.principle": "plan_execute",
          "harness.quadrant.x": "feedforward",
          "harness.quadrant.y": "inferential",
          "harness.version": "0.16.0",
          "harness.inferred": true,
          "gen_ai.operation.name": "chat",
          "gen_ai.request.model": "claude-sonnet-4",
          "gen_ai.response.finish_reasons": ["stop"]
        },
        {
          "span_id": "00000000000000a3",
          "trace_id": "0af7651916cd43dd8448eb211c80319c",
          "parent_span_id": null,
          "name": "execute_tool write_file",
          "harness.event_type": "tool.call",
          "harness.principle": "plan_execute",
          "harness.version": "0.16.0",
          "harness.mutated_state": true,
          "gen_ai.operation.name": "execute_tool",
          "gen_ai.tool.name": "write_file"
        }
      ]
    }
  ]
}
